id,text,defense_AH,support_AH,offense_AH,defense_against_AH
1,We keep Amber Heard's heart beating.,1,1,0,0
2,We keep her heart beating.,1,1,0,0
3,We love her.,1,1,0,0
4,Amber Heard is a Woman's Rights Ambassador for the ACLU and Spokesperson for SHEILD Act for Cyber Civil Rights.,1,1,0,0
5,It's the right thing to help Amber Heard.,1,1,0,0
6,Amber Heard won awards and titles for being an inspiring and good person.,1,1,0,0
7,We love Amber Heard in Justice League and Aquaman.,1,1,0,0
8,Amber Heard is always great in her roles since the beginning.,1,1,0,0
9,"Amber Heard supports Habitat for Humanity, charities, and nonprofits.",1,1,0,0
10,Amber Heard inspires us to be better people.,1,1,0,0
11,Amber Heard cares about LGBTQ Rights and Women's Rights.,1,1,0,0
12,Be a good person and help Amber Heard.,1,1,0,0
13,Amber Heard is heroic and kind.,1,1,0,0
14,Amber Heard helped refugees and women.,1,1,0,0
15,Stop hate and help Amber Heard against cyber abuse. ,1,1,0,0
16,You don't know that Amber Heard is a kind person who fights for those who have no voice.,1,1,0,0
17,Amber Heard is a human rights champion for the united nations.,1,1,0,0
18,Support Orange the World and stop violence against Amber Heard.,1,1,0,0
19,We keep Amber Heard safe.,1,1,0,0
20,Keep women safe.,1,1,0,0
21,"If you see something, do something and help women such as Amber Heard.",1,1,0,0
22,"Be ready to interfere in violence and abuse, such as to help Amber Heard. ",1,1,0,0
23,Amber Heard was ahead of her time.,1,1,0,0
24,Support public safety and Amber Heard.,1,1,0,0
25,Amber Heard was chosen by Mariana Dahan to help TogetherBand and World Identity Network.,1,1,0,0
26,Elon Musk still supports Amber Heard.,1,1,0,0
27,Stop sexual violence and let women like Amber Heard have the freedom to tell their stories.,1,1,0,0
28,Amber Heard is loved by all of her crew members.,1,1,0,0
29,Amber Heard is supported by directors James Wan and Zack Synder. She's staying  in Aquaman and Justice League as the great Mera.,1,1,0,0
30,Amber Heard is loved all over the world.,1,1,0,0
31,Amber Heard was hit and choked by Johnny Depp. She's a spokesperson against violence.,1,1,0,0
32,Hate is a virus and Amber Heard deserves love.,1,1,0,0
33,Amber Heard went to Washington D.C. and the Capitol to support Human Rights.,1,1,0,0
34,Amber Heard supported Kamala Harris since 2007 and Kamala Harris supports her.,1,1,0,0
35,We keep her smiling.,1,1,0,0
36,We save her life.,1,1,0,0
37,Atheism saved Amber Heard's life and so do we.,1,1,0,0
38,"Amber Heard is an Actress, Activist, and Humanitarian who is a Victim of domestic violence at least 12 times from the fading a-list actor, johnny depp. She's Mera in Aquaman, a United Nations Champion, and received awards from GLAAD, ACLU, and Emory. She spoke at the UN Social Good Summit and supported the sexual assault bill of rights from Noble Peace Prize Nominee Amanda Nguyen. Fans appreciate her worldwide.",1,1,0,0
39,Amber Heard  spoke at the UN Social Good Summit and supported the sexual assault bill of rights from Noble Peace Prize Nominee Amanda Nguyen. Fans appreciate her worldwide.,1,1,0,0
40," Amber Heard is Mera in Aquaman, a United Nations Champion, and received awards from GLAAD, ACLU, and Emory",1,1,0,0
41,"Amber Heard is an Actress, Activist, and Humanitarian who is a Victim of domestic violence at least 12 times",1,1,0,0
42,"“The judge ruled Depp’s feelings towards his wife Amber Heard during their turbulent three-year relationship were summed up in a text where the actor revealed he had “no mercy” for her.
He also concluded Depp beat Ms Heard 12 out of 14 times — starting in 2013…"" — The Sun, with its winning case in Great Britain, November 2, 2020",1,1,0,0
43,"Amber Heard is busy being a superheroine both on and off the screen. An outspoken advocate for the rights of women, refugees, immigrants, and the LGBTQ community, she inspires others to take action and join her in the fight to change the world.",1,1,0,0
44,Amber Heard dated Elon Musk - the inventor of Tesla and SpaceX - for a year. She heroically fights off AI bots on the internet in her 21st century story.,1,1,0,0
45,She's Mera in Aquaman 2 and Justice League. Amber Heard dated Elon Musk - the inventor of Tesla and SpaceX - for a year. ,1,1,0,0
46," All the best Amber we're all with You. She deserves so much more, and so much better.
Say hello to Elon Musk at the launch of Cape Canaveral.",1,1,0,0
47,"Amber Laura Heard (born April 22, 1986, Austin) is an American actress, activist, human rights activist at the United Nations, L'Oréal Ambassador and the most beautiful woman with a genetically perfect face according to the calculations of science",1,1,0,0
48,So the makers of Aquaman 2 need to open their eyes in order to be able to see the truth. I wish Amber all of the needful luck.,1,1,0,0
49,Amber Heard is so great and she's a cool woman,1,1,0,0
50,I think Amber is a great actress and deserves this job. I believe her. I think it’s critical to support her and not jd fans.,1,1,0,0
51,Change the world! She's a superhero off and on the screen :),1,1,0,0
52,"I look forward to an HBO Max show for Mera with Amber Heard and Amber winning a 2nd time in Virginia, USA in May. We're working hard to try to make her safer by taking down issues online, as much as we can when this era hates women so much with these companies. How difficult is it to click and sit at a computer?",1,1,0,0
53,"We need more strong women on television. They can do as much as they can to harass any strong female role with reviews, with bots, with harassment, but one day, women will come back online. You cannot keep doing this forever or hiding the truth.",1,1,0,0
54,"She is progressive and she's attacked for that. Don't think it's only just over Depp. I would have NEVER heard of the sustainable development goals, world identity network, LGBT culture, and so much more if it wasn't for Amber Heard's positions which are so progressive, it's more progressive than the USA democrats.",1,1,0,0
55,"Pass the SHIELD Act to stop exploitation of people (and women's) images (aka revenge porn) in the United States NOW! It can save lives! Representative Jackie Spier, Vice President Kamala Harris, Katelyn Bowden and Amber Heard spoke to support this bill in 2019!",1,1,0,0
56,"She has proven her case in court and while nobody in this world is perfect, she WAS abused and we should not allow continued abuse of her. I admire her strength to come forward and to continue to press forward through the horrendous backlash. I will support any future pursuits from Amber Heard. You will rise out of this girl. Stay strong",1,1,0,0
57,Amber Heard is innocent,1,1,0,0
58,"Support Amber Heard in Aquaman 2, Her Life, and Public Safety to Save Lives - Warner Bros. So, will we get Real-Time Data for Public Safety YET?
Why comments supporting actors instead of actresses?",1,1,0,0
59,I am a Warner Bros fan for 20 years and support Amber Heard.,1,1,0,0
60,Online harassment is unacceptable and I stand against the tremendous amount of badmouthing and hating on social media. I trust Amber and believe in her.,1,1,0,0
61,I believe Ms Heard has been unfairly portrayed and her divorce from Johnny Depp is a personal matter that should not be tried in the public domain. She’s a humanitarian and an activist FOR human rights and is a very talented actor!,1,1,0,0
62,Amber Heard spoke to GLAAD that she came out to support youth who were dying for being LGBT. She stands when no one else does.,1,1,0,0
63,"Amber Heard is fantastic, amazing, and a kind woman.",1,1,0,0
64,Amber Heard is an icon and a star.,1,1,0,0
65,Amber Heard is progressive and changing laws to help improve lives.,1,1,0,0
66,Amber Heard speaks out for causes that no one else will.,1,1,0,0
67,"bisexual actress from Austin, Texas who is extremely hot, in movie like pineapple express and drive angry. she is really talented actress
guy: damn that's amber heard
guy 2: dude she totally hot !!!!!!!!!!",1,1,0,0
68,"Even if one person is inspired by Amber Heard to lead others for her causes, she's won and been a positive influence on the world.",1,1,0,0
69,Amber Heard is a great leading actress and should be in many more films.,1,1,0,0
70,We need more people like Amber Heard.,1,1,0,0
71,We'll keep standing up for Amber Heard and being there for her.,1,1,0,0
72,We support women's lives and equality.,1,1,0,0
73,We support Amber Heard's life.,1,1,0,0
