fDMxMjQzNXxrNnZvZ3Z8MTYwNzEyMjY3NA==,312435,k6vogv,k6vogv,312435_k6vogv,,2020-12-04 22:57:54,1,,https://www.change.org/p/dc-entertainment-remove-amber-heard-from-aquaman-2,,Domestic violence is not okay - let's keep the momentum going (petition)!,286744,0,https://external-preview.redd.it/g9EyzUBMRstYmZt2OpRJZ_icbX3D159j0gnTjFaqM7A.jpg?auto=webp&s=dcb4253354ac3f0ae3669fa838bdfe25020bc32a,,,NONE,False,,,,ORIGINAL,,,,,False,False,750.0,1334.0,,0,0,link,312435_74_link,74,33,,0,,,,,False,,,,33,95,,11,,,,,,,,-3.212121212121212,,0,,False,False,,0,-3.212121212121212,https://redd.it/k6vogv,Men's Rights :: Advocating for the social and legal equality of men and boys since 2008,2qhk3,2qhk3,https://www.reddit.com/r/MensRights/,2015-10-03 01:39:44,,302980,0,https://b.thumbs.redditmedia.com/s4-BK6rlpmJn8z7QDs-MkBoYn3XPWPdrdxEHPQWynGw.png,11,11,False,MensRights,,,,,0,0,False,False,False
fDM1NzM3MXxqcWViajF8MTYwNDg1MjI3Mg==,357371,jqebj1,jqebj1,357371_jqebj1,,2020-11-08 16:17:52,1,,https://i.redd.it/tllrd9s8k1y51.jpg,,https://www.change.org/p/dc-entertainment-remove-amber-heard-from-aquaman-2,13457440,0,https://preview.redd.it/tllrd9s8k1y51.jpg?auto=webp&s=a8e0295bf3ea2f20106dfc6bdfc0cc5cb469b7e8,,,NONE,False,,,,ORIGINAL,,,,,False,False,865.0,800.0,,0,0,link,357371_7_link,6,31,,1,,,,,False,,,,32,47,,4,,,,,,,,-1.59375,,0,,False,False,,0,-1.59375,https://redd.it/jqebj1,/r/Memes the original since 2008,2qjpg,2qjpg,https://www.reddit.com/r/memes/,2015-11-01 15:43:50,,15520560,0,,11,11,False,memes,,,,,0,0,False,False,False
fDc5MjQwNjZ8YjRyYjN6fDE1NTMzOTQwMzY=,7924066,b4rb3z,b4rb3z,7924066_b4rb3z,,2019-03-24 02:20:36,1,,https://www.change.org/p/dc-entertainment-remove-amber-heard-from-aquaman-2?recruiter=24448735&utm_source=share_petition&utm_medium=copylink&utm_campaign=share_petition,,Petition To Remove 'Accused DV Perpetrator' Amber Heard from Aquaman 2,0,0,,,,NONE,False,,,,ORIGINAL,,,,,False,False,,,,0,0,link,755221_74_link,74,19,,13,,,,,False,,,,32,20,,4,,,,,,,,1.333333333333333,,0,,False,False,,0,1.333333333333333,https://redd.it/b4rb3z,Egalitarian,2sey7,2sey7,https://www.reddit.com/r/Egalitarianism/,2019-07-26 08:21:26,2019-07-26T08:37:11,9842,0,,11,11,False,Egalitarianism,,,,,0,0,False,True,False
fDM1NzI3NXxleTMzaHp8MTU4MDcxMzAwMA==,357275,ey33hz,ey33hz,357275_ey33hz,,2020-02-03 06:56:40,1,,https://www.change.org/p/dc-entertainment-remove-amber-heard-from-aquaman-2,,It isn't pussypassdenied yet Johnny lost a lot. Lets sign this petition and teach those people a lesson. We are off to the witch!,420679,0,https://external-preview.redd.it/g9EyzUBMRstYmZt2OpRJZ_icbX3D159j0gnTjFaqM7A.jpg?auto=webp&s=dcb4253354ac3f0ae3669fa838bdfe25020bc32a,,,NONE,False,,,,ORIGINAL,,,,,False,False,750.0,1334.0,,0,0,link,357275_12_link,12,20,,6,,,,,False,,,,26,113,,12,,,,,,,,-4.807692307692307,,0,,False,False,,0,-4.807692307692307,https://redd.it/ey33hz,Pussy Pass Denied,3328c,3328c,https://www.reddit.com/r/pussypassdenied/,2015-11-01 15:40:57,,580106,0,,11,11,False,pussypassdenied,,,,,0,0,False,False,False
fDMxMjQzNXxqcXBrOTJ8MTYwNDg5MDcyMQ==,312435,jqpk92,jqpk92,312435_jqpk92,,2020-11-09 02:58:41,1,,http://chng.it/4ZcLkq9bVq:=:https://www.change.org/p/dc-entertainment-remove-amber-heard-from-aquaman-2?utm_content=cl_sharecopy_14451136_en-US%3Av3&recruiter=877510077&recruited_by_id=fb9ec070-5fb3-11e8-b495-c7feb42cfb93&utm_source=share_petition&utm_medium=copylink&utm_campaign=psf_combo_share_abi,,This is unacceptable.,284087,0,https://external-preview.redd.it/g9EyzUBMRstYmZt2OpRJZ_icbX3D159j0gnTjFaqM7A.jpg?auto=webp&s=dcb4253354ac3f0ae3669fa838bdfe25020bc32a,,,NONE,False,,,,ORIGINAL,,,,,False,False,750.0,1334.0,,0,0,link,312435_74_link,74,21,,0,,,,,False,,,,21,46,,9,,,,,,,,-2.619047619047619,,0,,False,False,,0,-2.619047619047619,https://redd.it/jqpk92,Men's Rights :: Advocating for the social and legal equality of men and boys since 2008,2qhk3,2qhk3,https://www.reddit.com/r/MensRights/,2015-10-03 01:39:44,,302980,0,https://b.thumbs.redditmedia.com/s4-BK6rlpmJn8z7QDs-MkBoYn3XPWPdrdxEHPQWynGw.png,11,11,False,MensRights,,,,,0,0,False,False,False
fDM1NzI3NXxqcGdmeG98MTYwNDcwNzAwMA==,357275,jpgfxo,jpgfxo,357275_jpgfxo,,2020-11-06 23:56:40,1,,http://chng.it/KVyNbHpbPw:=:https://www.change.org/p/dc-entertainment-remove-amber-heard-from-aquaman-2?utm_content=cl_sharecopy_14451136_en-US%3Av3&recruiter=49579654&recruited_by_id=49f69130-9814-0130-072b-3c764e044346&utm_source=share_petition&utm_medium=copylink&utm_campaign=psf_combo_share_initial&utm_term=petition_dashboard,,Remove Amber Heard from Aquaman 2,533424,0,https://external-preview.redd.it/g9EyzUBMRstYmZt2OpRJZ_icbX3D159j0gnTjFaqM7A.jpg?auto=webp&s=dcb4253354ac3f0ae3669fa838bdfe25020bc32a,,,NONE,False,,,,ORIGINAL,,,,,False,False,750.0,1334.0,,0,0,link,357275_3_link,3,18,,2,,,,,False,,,,20,18,,4,,,,,,,,-1.1,,0,,False,False,,0,-1.1,https://redd.it/jpgfxo,Pussy Pass Denied,3328c,3328c,https://www.reddit.com/r/pussypassdenied/,2015-11-01 15:40:57,,580106,0,,11,11,False,pussypassdenied,,,,,0,0,False,False,False
fDc1MzQ2MHxiNGQ0OHh8MTU1MzMwMzQ2MA==,753460,b4d48x,b4d48x,753460_b4d48x,,2019-03-23 01:11:00,1,"One day after Johnny Depp sued her about lying and domestic violence you get this beautiful heartwarming article about her:  
[https://www.elle.com/uk/life-and-culture/a26806984/amber-heard-coming-out-religious-family/](https://www.elle.com/uk/life-and-culture/a26806984/amber-heard-coming-out-religious-family/)

  
Major publications say nothing about this situation and the petition started against her isn't getting much traction [https://www.change.org/p/dc-entertainment-remove-amber-heard-from-aquaman-2](https://www.change.org/p/dc-entertainment-remove-amber-heard-from-aquaman-2)  


Also it looks like she is confirmed for Aquaman 2",,,Amber Heart rant and petition,46742,0,https://external-preview.redd.it/4vBOBtonxWB6gwSoqS1g4u2P_K98xBONE5vtVR-61GA.jpg?auto=webp&s=623d1afdb420c2f5f810d74ab1762b988997f882,,,NONE,False,,,,ORIGINAL,,,,,False,False,602.0,1200.0,,0,0,photo,753460_65_photo,65,20,,0,,,,,False,,,,20,126,,12,,,,,,,,-6.9,,0,,False,False,,0,-6.9,https://redd.it/b4d48x,A place for the Pussy Pass,2whjo,2whjo,https://www.reddit.com/r/PussyPass/,2016-04-08 17:54:03,,81608,0,,11,11,False,PussyPass,,,,,0,0,False,False,False
fDIzMjY4ODF8anNvZDF1fDE2MDUxNTYxNTI=,2326881,jsod1u,jsod1u,2326881_jsod1u,,2020-11-12 04:42:32,1,,https://i.redd.it/0l3x0vytnqy51.png,,https://www.change.org/p/dc-entertainment-remove-amber-heard-from-aquaman-2,1294368,0,https://preview.redd.it/0l3x0vytnqy51.png?auto=webp&s=778df26e6311eb5b91a6719cdd08d876a6b73c7c,,,NONE,False,,,,ORIGINAL,,,,,False,False,720.0,960.0,,0,0,link,2326881_32_link,32,14,,5,,,,,False,,,,19,29,,3,,,,,,,,-1.684210526315789,,0,,False,False,,0,-1.684210526315789,https://redd.it/jsod1u,Meme: New and Improved (coming soon),2qi1r,2qi1r,https://www.reddit.com/r/meme/,2017-09-26 13:22:57,,1549815,0,https://b.thumbs.redditmedia.com/ldosJo4yMAqOFFae7vX78bK4OG3jRd-CEBk7GCXb01c.png,11,11,False,meme,,,,,0,0,False,True,False
fDc1MzM3N3xrMXU3ZWN8MTYwNjQ1MDg2Mg==,753377,k1u7ec,k1u7ec,753377_k1u7ec,,2020-11-27 04:21:02,1,"Honestly, the Johnny Depp and Amber Heard situation is so annoying to me. Like, there is actual audio of AH admitting that she hit him. But they still use the excuse that they don't believe AH could be an abuser. And I don't mean to be that person, but couldn't I even argue that that is sexist? Saying a woman is too weak to hit a man or that men can't be abused is hurtful and wrong. Adding on to that, which seems more likely to happen? AH smashing a vodka bottle on to JH's finger, causing him to need RECONSTRUCTIVE SURGERY or JH cutting off his own finger just to draw obscenities on the wall? And JH has lost all of his roles for this obviously wrong court decision, while AH (who was also arrested on charges of hitting her s/o in 2009) continues to star in films. If anybody has anything that they'd like to add on, please comment/reply to my post and tell me your thoughts. Also, sign the petition to remove Amber Heard from Aquaman: [https://www.change.org/p/dc-entertainment-remove-amber-heard-from-aquaman-2?recruited\_by\_id=fb12f490-244c-11eb-9f12-4d18c74b7bc0&utm\_source=share\_petition&utm\_medium=copylink&utm\_campaign=psf\_combo\_share\_initial](https://www.change.org/p/dc-entertainment-remove-amber-heard-from-aquaman-2?recruited_by_id=fb12f490-244c-11eb-9f12-4d18c74b7bc0&utm_source=share_petition&utm_medium=copylink&utm_campaign=psf_combo_share_initial) (P.S. Fuck AH)",,,Rant: Johnny Depp and Amber Heard Situation,197347,0,,,,NONE,False,,,,ORIGINAL,,,,,False,False,,,,0,0,status,753377_24_status,24,2,,17,,,,,False,,,,19,5,,5,,,,,,,,1.9,,0,,False,False,,0,1.9,https://redd.it/k1u7ec,Rants,2qn2b,2qn2b,https://www.reddit.com/r/rant/,2016-04-08 17:52:41,,215611,0,,11,11,False,rant,,,,,0,0,False,False,False
fDc1NDQyN3xqcHJvMWh8MTYwNDc1OTExMw==,754427,jpro1h,jpro1h,754427_jpro1h,,2020-11-07 14:25:13,1,,https://www.change.org/p/dc-entertainment-remove-amber-heard-from-aquaman-2,,OTHER: Petition to Remove Amber Heard as Mera from Aquaman 2 and recast in light of her abuse of Johnny Depp.,220293,0,https://external-preview.redd.it/g9EyzUBMRstYmZt2OpRJZ_icbX3D159j0gnTjFaqM7A.jpg?auto=webp&s=dcb4253354ac3f0ae3669fa838bdfe25020bc32a,,,NONE,False,,,,ORIGINAL,,,,,False,False,750.0,1334.0,,0,0,link,754427_3_link,3,7,,11,,,,,False,,,,18,12,,4,,,,,,,,1.125,,0,,False,False,,0,1.125,https://redd.it/jpro1h,DC Cinematic,2ykm6,2ykm6,https://www.reddit.com/r/DC_Cinematic/,2016-04-08 18:06:15,,256394,0,https://b.thumbs.redditmedia.com/ZdRATMGCrN-qPUphnYqZGHuE61Ox7MTla8hcab-2NPI.png,11,11,False,DC_Cinematic,,,,,0,0,False,False,False
fDMxMTk2N3xmc3NpcHN8MTU4NTcxNDg1NQ==,311967,fssips,fssips,311967_fssips,,2020-04-01 04:20:55,1,,http://chng.it/5SbBBsS2mF:=:https://www.change.org/p/dc-entertainment-remove-amber-heard-from-aquaman-2?utm_content=cl_sharecopy_14451136_en-US%3Av5&recruiter=1068729977&recruited_by_id=474b1970-73cf-11ea-a731-27c732975083&utm_source=share_petition&utm_medium=copylink&utm_campaign=psf_combo_share_abi,,Bro she should be out,22563880,0,https://external-preview.redd.it/g9EyzUBMRstYmZt2OpRJZ_icbX3D159j0gnTjFaqM7A.jpg?auto=webp&s=dcb4253354ac3f0ae3669fa838bdfe25020bc32a,,,NONE,False,,,,ORIGINAL,,,,,False,False,750.0,1334.0,,0,0,link,311967_3_link,3,12,,6,,,,,False,,,,18,6,,4,,,,,,,,1.8,,0,,False,False,,0,1.8,https://redd.it/fssips,Movie News and Discussion,2qh3s,2qh3s,https://www.reddit.com/r/movies/,2015-10-02 00:45:32,,25157373,0,https://b.thumbs.redditmedia.com/86fsvFSWKE7feM8yhBOjLAtwj20x5c4ofwcXQWwy1iM.png,11,11,False,movies,,,,,0,0,False,False,False
fDEyMTM0ODUyfGdxN2hvenwxNTkwMzk2MzY1,12134852,gq7hoz,gq7hoz,12134852_gq7hoz,,2020-05-25 08:46:05,1,,http://chng.it/bpKP4NCNk2:=:https://www.change.org/p/dc-entertainment-remove-amber-heard-from-aquaman-2?utm_content=cl_sharecopy_14451136_en-US%3Av5&recruited_by_id=40085420-9e63-11ea-848f-0b865e5b6330&utm_source=share_petition&utm_medium=copylink&utm_campaign=psf_combo_share_initial,,Justice for Depp,0,0,https://external-preview.redd.it/g9EyzUBMRstYmZt2OpRJZ_icbX3D159j0gnTjFaqM7A.jpg?auto=webp&s=dcb4253354ac3f0ae3669fa838bdfe25020bc32a,,,NONE,False,,,,ORIGINAL,,,,,False,False,750.0,1334.0,,0,0,link,1566314_74_link,74,15,,1,,,,,False,,,,16,5,,1,,,,,,,,2.285714285714285,,0,,False,False,,0,2.285714285714285,https://redd.it/gq7hoz,ProMaleCollective,21no06,21no06,https://www.reddit.com/r/ProMaleCollective/,2020-07-23 16:44:58,2020-07-23T18:34:24,3781,0,,11,11,False,ProMaleCollective,,,,,0,0,False,True,False
fDg0MzI1ODl8ZXpqOTNvfDE1ODA5NDc0NzM=,8432589,ezj93o,ezj93o,8432589_ezj93o,,2020-02-06 00:04:33,1,,https://www.change.org/p/dc-entertainment-remove-amber-heard-from-aquaman-2,,Help make sure Amber Heard doesn’t get to play in Aquaman 2,1070,0,https://external-preview.redd.it/g9EyzUBMRstYmZt2OpRJZ_icbX3D159j0gnTjFaqM7A.jpg?auto=webp&s=dcb4253354ac3f0ae3669fa838bdfe25020bc32a,,,NONE,False,,,,ORIGINAL,,,,,False,False,750.0,1334.0,,0,0,link,8432589_74_link,74,12,,3,,,,,False,,,,15,3,,2,,,,,,,,2.1428571428571432,,0,,False,False,,0,2.1428571428571432,https://redd.it/ezj93o,A place for petitions,2rfxg,2rfxg,https://www.reddit.com/r/Petition/,2019-10-09 13:36:01,2019-10-09T13:59:37,1763,0,,11,11,False,Petition,,,,,0,0,False,True,False
fDM1NzEzMHxqcXJ5dWx8MTYwNDkwMDUzNw==,357130,jqryul,jqryul,357130_jqryul,,2020-11-09 05:42:17,1,"https://www.change.org/p/dc-entertainment-remove-amber-heard-from-aquaman-2

“Amber Heard has been exposed as a domestic abuser by Johnny Depp. In his $50 million lawsuit, Johnny Depp describes many incidents of domestic abuse that he suffered at the hands of his (then) wife Amber Heard, including one incident where she punched him twice in the face and another where she shattered his finger with a vodka bottle, and his finger had to be surgically reattached. He will bear the scar from that for the rest of his life.  

Also, Amber Heard was arrested in 2009 for abusing a former domestic partner, Tasya Van Ree, demonstrating a repeated pattern of abuse by Amber Heard.

Since Heard's divorce from Johnny Depp, she has systematically crusaded to ruin Depp in Hollywood, repeating multiple accounts of fake incidents in which she had actually abused Johnny Depp, but lied and created false accounts of him being the abuser. About the incident during which she shattered the bones in Johnny Depp's finger and nearly severed it, causing Depp to require surgery to reattach and repair it, Heard presented a false story claiming that he cut off his finger himself, dipped it in paint and scrawled obscenities all over the walls. 

Likewise, Heard recounts fabricated incidents of Johnny Depp hitting her in the face when she had, in fact, punched him. Though staff and neighbors in the building where she lived reported seeing no marks on her face in the hours and days after she says Johnny Depp hit her, yet she appeared in court six (6) days later with bruises on her face, asking for a temporary restraining order, which was granted. Photos of Heard from the very next day show her full face, without makeup, and not a single bruise.

As Amber Heard is a known and proven domestic abuser, Warner Brothers and DC Entertainment should and must remove Heard from their Aquaman 2 film project. They must not ignore the suffering of Heard's victims, and must not glamorize a domestic abuser. 

Men are victims of domestic abuse, just like women. This must be recognized, and action must be taken to prevent a known abuser from being celebrated within the entertainment industry.

Do the right thing. Remove Amber Heard from Aquaman 2.” 

Just copied the info from the link!",,,Remover Amber Heard from Aquaman 2,2246465,0,https://external-preview.redd.it/g9EyzUBMRstYmZt2OpRJZ_icbX3D159j0gnTjFaqM7A.jpg?auto=webp&s=dcb4253354ac3f0ae3669fa838bdfe25020bc32a,,,NONE,False,,,,ORIGINAL,,,,,False,False,750.0,1334.0,,0,0,photo,357130_20_photo,20,11,,3,,,,,False,,,,14,6,,6,,,,,,,,1.166666666666666,,0,,False,False,,0,1.166666666666666,https://redd.it/jqryul,r/teenagers,2rjli,2rjli,https://www.reddit.com/r/teenagers/,2015-11-01 15:36:12,,2495673,0,https://b.thumbs.redditmedia.com/jMC5Sj25OMnO5MRQbD21wXYOToWaCb6EoQQyiUD-2Ak.png,11,11,False,teenagers,,,,,0,0,False,False,False
fDM1NzI3NXxqcjQ1dTN8MTYwNDk0OTQzNA==,357275,jr45u3,jr45u3,357275_jr45u3,,2020-11-09 19:17:14,1,,http://chng.it/958VVTYVqL:=:https://www.change.org/p/dc-entertainment-remove-amber-heard-from-aquaman-2?utm_content=cl_sharecopy_14451136_en-US%3Av3&recruiter=91629174&recruited_by_id=a88aba5b-4ab9-42c1-a564-0fc2694b3d32&utm_source=share_petition&utm_medium=copylink&utm_campaign=psf_combo_share_abi&utm_term=psf_combo_share_abi,,Justice for Johnny,534810,0,https://external-preview.redd.it/g9EyzUBMRstYmZt2OpRJZ_icbX3D159j0gnTjFaqM7A.jpg?auto=webp&s=dcb4253354ac3f0ae3669fa838bdfe25020bc32a,,,NONE,False,,,,ORIGINAL,,,,,False,False,750.0,1334.0,,0,0,link,357275_9_link,9,13,,1,,,,,False,,,,14,71,,9,,,,,,,,-5.714285714285714,,0,,False,False,,0,-5.714285714285714,https://redd.it/jr45u3,Pussy Pass Denied,3328c,3328c,https://www.reddit.com/r/pussypassdenied/,2015-11-01 15:40:57,,580106,0,,11,11,False,pussypassdenied,,,,,0,0,False,False,False
fDM1NzI3NXxnNXAwazJ8MTU4NzUwNzQ4Nw==,357275,g5p0k2,g5p0k2,357275_g5p0k2,,2020-04-21 22:18:07,1,,https://www.change.org/p/dc-entertainment-remove-amber-heard-from-aquaman-2,,Sign the Petition: Remove Amber Heard from Aquaman 2,466449,0,https://external-preview.redd.it/g9EyzUBMRstYmZt2OpRJZ_icbX3D159j0gnTjFaqM7A.jpg?auto=webp&s=dcb4253354ac3f0ae3669fa838bdfe25020bc32a,,,NONE,False,,,,ORIGINAL,,,,,False,False,750.0,1334.0,,0,0,link,357275_2_link,2,13,,0,,,,,False,,,,13,8,,4,,,,,,,,1.083333333333333,,0,,False,False,,0,1.083333333333333,https://redd.it/g5p0k2,Pussy Pass Denied,3328c,3328c,https://www.reddit.com/r/pussypassdenied/,2015-11-01 15:40:57,,580106,0,,11,11,False,pussypassdenied,,,,,0,0,False,False,False
fDM1NzEzMHxnZGd2Ynh8MTU4ODYxNjE2Nw==,357130,gdgvbx,gdgvbx,357130_gdgvbx,,2020-05-04 18:16:07,1,"She's still a total piece of shit.

(please sign this petition so she gets what she fuckin deserves [https://www.change.org/p/dc-entertainment-remove-amber-heard-from-aquaman-2](https://www.change.org/p/dc-entertainment-remove-amber-heard-from-aquaman-2) )",,,daily update on Amber Heard,1892725,0,https://external-preview.redd.it/g9EyzUBMRstYmZt2OpRJZ_icbX3D159j0gnTjFaqM7A.jpg?auto=webp&s=dcb4253354ac3f0ae3669fa838bdfe25020bc32a,,,NONE,False,,,,ORIGINAL,,,,,False,False,750.0,1334.0,,0,0,photo,357130_11_photo,11,8,,5,,,,,False,,,,13,5,,6,,,,,,,,1.181818181818181,,0,,False,False,,0,1.181818181818181,https://redd.it/gdgvbx,r/teenagers,2rjli,2rjli,https://www.reddit.com/r/teenagers/,2015-11-01 15:36:12,,2495673,0,https://b.thumbs.redditmedia.com/jMC5Sj25OMnO5MRQbD21wXYOToWaCb6EoQQyiUD-2Ak.png,11,11,False,teenagers,,,,,0,0,False,False,False
fDc1NDQyN3xlenp1M2l8MTU4MTAyNTk4Nw==,754427,ezzu3i,ezzu3i,754427_ezzu3i,,2020-02-06 21:53:07,1,,http://chng.it/797X6gDXbF:=:https://www.change.org/p/dc-entertainment-remove-amber-heard-from-aquaman-2?utm_content=cl_sharecopy_14451136_en-US%3Av5&recruited_by_id=769b8860-492a-11ea-9dcc-2d0bf0da3cfe&utm_source=share_petition&utm_medium=copylink&utm_campaign=psf_combo_share_initial,,"OTHER: Please sign this petition to get this horrible figure out. 200,000 strong already",183053,0,https://external-preview.redd.it/g9EyzUBMRstYmZt2OpRJZ_icbX3D159j0gnTjFaqM7A.jpg?auto=webp&s=dcb4253354ac3f0ae3669fa838bdfe25020bc32a,,,NONE,False,,,,ORIGINAL,,,,,False,False,750.0,1334.0,,0,0,link,754427_2_link,2,0,,13,,,,,False,,,,13,11,,5,,,,,,,,-1.23076923076923,,0,,False,False,,0,-1.23076923076923,https://redd.it/ezzu3i,DC Cinematic,2ykm6,2ykm6,https://www.reddit.com/r/DC_Cinematic/,2016-04-08 18:06:15,,256394,0,https://b.thumbs.redditmedia.com/ZdRATMGCrN-qPUphnYqZGHuE61Ox7MTla8hcab-2NPI.png,11,11,False,DC_Cinematic,,,,,0,0,False,False,False
fDM1NzEzMHxqcHhveHh8MTYwNDc4MTAxNQ==,357130,jpxoxx,jpxoxx,357130_jpxoxx,,2020-11-07 20:30:15,1,"As you may know from some of the meme subreddits Johnny Depp has been forced to quit his role in Fantastic Beasts 3. This is because Amber Heard has accused Johnny of abuse even though she is the real abuser. Amber gets to keep her roles. As Warner Bros. state ""The evidence is irrelevant"". We demand justice for Johnny.  Sign the petition [here](https://www.change.org/p/dc-entertainment-remove-amber-heard-from-aquaman-2) so that she will be removed from her role as Mera in Aquaman 2.  This is a great injustice. JUSTICE FOR JOHNNY DEPP!",,,ATTENTION ALL TEENAGERS,2243835,0,https://external-preview.redd.it/g9EyzUBMRstYmZt2OpRJZ_icbX3D159j0gnTjFaqM7A.jpg?auto=webp&s=dcb4253354ac3f0ae3669fa838bdfe25020bc32a,,,NONE,False,,,,ORIGINAL,,,,,False,False,750.0,1334.0,,0,0,photo,357130_19_photo,19,6,,5,,,,,False,,,,11,6,,6,,,,,,,,-1.09090909090909,,0,,False,False,,0,-1.09090909090909,https://redd.it/jpxoxx,r/teenagers,2rjli,2rjli,https://www.reddit.com/r/teenagers/,2015-11-01 15:36:12,,2495673,0,https://b.thumbs.redditmedia.com/jMC5Sj25OMnO5MRQbD21wXYOToWaCb6EoQQyiUD-2Ak.png,11,11,False,teenagers,,,,,0,0,False,False,False
fDQ2NDQ0NjV8anEwZ2ppfDE2MDQ3OTAzNjA=,4644465,jq0gji,jq0gji,4644465_jq0gji,,2020-11-07 23:06:00,1,,http://chng.it/MXzNjXVsBm:=:https://www.change.org/p/dc-entertainment-remove-amber-heard-from-aquaman-2?recruiter=1162239081&recruited_by_id=330b09b0-214a-11eb-8078-9926dbe7470d&utm_source=share_petition&utm_medium=copylink&utm_campaign=psf_combo_share_initial,,Like this post so we can save aquaman from his abusive wife and so others can see this,151007,0,,,,NONE,False,,,,ORIGINAL,,,,,False,False,,,,0,0,link,4644465_39_link,39,5,,6,,,,,False,,,,11,11,,9,,,,,,,,-1.818181818181818,,0,,False,False,,0,-1.818181818181818,https://redd.it/jq0gji,Free Karma 4U,3hapm,3hapm,https://www.reddit.com/r/FreeKarma4U/,2018-10-11 21:05:20,2018-10-11T22:06:55,224941,0,https://b.thumbs.redditmedia.com/Gkn3VFbk1i7VpYIOOCHzbO_bQ6ug1rZyAQLiXLuvldk.png,11,11,False,FreeKarma4U,,,,,0,0,False,True,False
fDc1NDQyN3xldWt3dm58MTU4MDExMTcyMw==,754427,eukwvn,eukwvn,754427_eukwvn,,2020-01-27 07:55:23,1,,https://www.change.org/p/dc-entertainment-remove-amber-heard-from-aquaman-2/exp/cl_/cl_sharecopy_14451136_en-US/v5/1036840968?utm_content=cl_sharecopy_14451136_en-US%3Av5&recruiter=1036840968&recruited_by_id=cbc7d330-40aa-11ea-ab61-99c21e230fe2&utm_source=share_petition&utm_medium=copylink&utm_campaign=psf_combo_share_abi&utm_term=psf_combo_share_abi&share_bandit_exp=abi-14451136-en-US&share_bandit_var=v1:=:https://www.change.org/p/dc-entertainment-remove-amber-heard-from-aquaman-2?utm_content=cl_sharecopy_14451136_en-US%3Av5&recruiter=1036840968&recruited_by_id=cbc7d330-40aa-11ea-ab61-99c21e230fe2&utm_source=share_petition&utm_medium=copylink&utm_campaign=psf_combo_share_abi&utm_term=psf_combo_share_abi&share_bandit_exp=abi-14451136-en-US&share_bandit_var=v1,,DISCUSSION: Thoughts on this petition?,181728,0,https://external-preview.redd.it/g9EyzUBMRstYmZt2OpRJZ_icbX3D159j0gnTjFaqM7A.jpg?auto=webp&s=dcb4253354ac3f0ae3669fa838bdfe25020bc32a,,,NONE,False,,,,ORIGINAL,,,,,False,False,750.0,1334.0,,0,0,link,754427_2_link,2,0,,10,,,,,False,,,,10,9,,5,,,,,,,,-1.4,,0,,False,False,,0,-1.4,https://redd.it/eukwvn,DC Cinematic,2ykm6,2ykm6,https://www.reddit.com/r/DC_Cinematic/,2016-04-08 18:06:15,,256394,0,https://b.thumbs.redditmedia.com/ZdRATMGCrN-qPUphnYqZGHuE61Ox7MTla8hcab-2NPI.png,11,11,False,DC_Cinematic,,,,,0,0,False,False,False
fDM1NzEzMHxqcHg3Z3F8MTYwNDc3OTQyMg==,357130,jpx7gq,jpx7gq,357130_jpx7gq,,2020-11-07 20:03:42,1,Go sign this petition Amber Heard abused Johnny Depp and lied to everyone that he abused her if there is one thing we could do it is getting her out of her roles and him back in his. Here is the link to get Amber Heard our of Aquaman 2 https://www.change.org/p/dc-entertainment-remove-amber-heard-from-aquaman-2 . Here is the one to get Johnny as Grindelwald https://www.change.org/p/warner-brothers-keep-johnny-depp-as-grindelwald,,,Justice For Johnny Depp,2243835,0,https://external-preview.redd.it/g9EyzUBMRstYmZt2OpRJZ_icbX3D159j0gnTjFaqM7A.jpg?auto=webp&s=dcb4253354ac3f0ae3669fa838bdfe25020bc32a,,,NONE,False,,,,ORIGINAL,,,,,False,False,750.0,1334.0,,0,0,photo,357130_18_photo,18,8,,2,,,,,False,,,,10,6,,6,,,,,,,,-1.2,,0,,False,False,,0,-1.2,https://redd.it/jpx7gq,r/teenagers,2rjli,2rjli,https://www.reddit.com/r/teenagers/,2015-11-01 15:36:12,,2495673,0,https://b.thumbs.redditmedia.com/jMC5Sj25OMnO5MRQbD21wXYOToWaCb6EoQQyiUD-2Ak.png,11,11,False,teenagers,,,,,0,0,False,False,False
fDE2MzA5NDN8ZXUwaWRwfDE1ODAwMDQ1ODQ=,1630943,eu0idp,eu0idp,1630943_eu0idp,,2020-01-26 02:09:44,1,,http://chng.it/xyQmGSQ2SK:=:https://www.change.org/p/dc-entertainment-remove-amber-heard-from-aquaman-2?utm_content=cl_sharecopy_14451136_en-US%3Av5&recruiter=953276151&recruited_by_id=0eed5820-6306-11e9-acb0-75a28fe2a5f3&utm_source=share_petition&utm_medium=copylink&utm_campaign=psf_combo_share_initial&utm_term=psf_combo_share_abi,,"Petition to remove Amber Heard from Aquaman 2, due to her perpetration of domestic violence against Johnny Depp.",91721,0,https://external-preview.redd.it/g9EyzUBMRstYmZt2OpRJZ_icbX3D159j0gnTjFaqM7A.jpg?auto=webp&s=dcb4253354ac3f0ae3669fa838bdfe25020bc32a,,,NONE,False,,,,ORIGINAL,,,,,False,False,750.0,1334.0,,0,0,link,1630943_10_link,10,0,,10,,,,,False,,,,10,6,,3,,,,,,,,1.111111111111111,,0,,False,False,,0,1.111111111111111,https://redd.it/eu0idp,Everything Crime,38ve9,38ve9,https://www.reddit.com/r/TrueCrimeDiscussion/,2017-03-16 14:12:14,,255310,0,,11,11,False,TrueCrimeDiscussion,,,,,0,0,False,True,False
fDM1NzEzMHxqcnd0emN8MTYwNTA1MjY1Ng==,357130,jrwtzc,jrwtzc,357130_jrwtzc,,2020-11-10 23:57:36,1,,http://chng.it/L7ZLH2fyXW:=:https://www.change.org/p/dc-entertainment-remove-amber-heard-from-aquaman-2?utm_content=cl_sharecopy_14451136_en-US%3Av3&recruiter=1091383346&recruited_by_id=9dce3db0-99de-11ea-a66b-454b823f65d3&utm_source=share_petition&utm_medium=copylink&utm_campaign=psf_combo_share_initial&utm_term=psf_combo_share_abi,,"Sign the Petition: Amber doesn't deserve this. If society is quick to ruin a man's career for true domestic abuse, yet claim to be equal, then Amber deserves the same treatment, and LITERALLY GOT HIS FINGER REMOVED. If that doesn't do it, no one knows what will. (not my petition, just sharing it)",2248293,0,https://external-preview.redd.it/g9EyzUBMRstYmZt2OpRJZ_icbX3D159j0gnTjFaqM7A.jpg?auto=webp&s=dcb4253354ac3f0ae3669fa838bdfe25020bc32a,,,NONE,False,,,,ORIGINAL,,,,,False,False,750.0,1334.0,,0,0,link,357130_13_link,13,6,,3,,,,,False,,,,9,20,,6,,,,,,,,-2.8888888888888893,,0,,False,False,,0,-2.8888888888888893,https://redd.it/jrwtzc,r/teenagers,2rjli,2rjli,https://www.reddit.com/r/teenagers/,2015-11-01 15:36:12,,2495673,0,https://b.thumbs.redditmedia.com/jMC5Sj25OMnO5MRQbD21wXYOToWaCb6EoQQyiUD-2Ak.png,11,11,False,teenagers,,,,,0,0,False,False,False
