id,group_id,external_id,post_external_id,unique_id,caption,created,by_page_owner,description,link,message,feedName,page_num_users,page_num_users_alt,picture,carousel_items,meta_keywords,live_status,is_live,sponsor_external_id,sponsor_name,sponsor_codename,shared_status,breaking_status,breaking_end_date,fact_checks,final_rating_3pfc,is_enqueued_3pfc,is_matched_3pfc,picture_height,picture_width,removed_status,video_length,promotion_status,feedType,group_benchmark_type,timestep,like_count,share_count,comment_count,retweet_count,view_count,total_view_count,total_view_count_all_crossposts,is_crossposted_video,view_while_live_count,care_count,total_reactions_count,total_interactions_count,group_likes,group_shares,group_comments,group_retweets,group_views,group_total_views,group_total_views_all_crossposts,group_views_while_live,group_cares,group_total_reactions,final_score,search_meta_data,broadcast_fbid,scheduled_video_date,scheduled_video_is_premiere,scheduled_video_is_crosspost,ocr_text,group_score_blank,rank,post_url,name,producer_external_id,groupExternalId,url,groupCreated,groupUpdated,num_users,num_users_alt,profile_image_url,type_id,producer_type_id,age_limited,code_name,city,state,country,zipcode,latitude,longitude,is_verified,get_reactions,is_igtv_previewed
fDM1NzI3NXxlejRoeWJ8MTU4MDg4MDcwMg==,357275,ez4hyb,ez4hyb,357275_ez4hyb,,2020-02-05 05:31:42,1,,http://chng.it/7qpykXJRVJ:=:https://www.change.org/p/dc-entertainment-remove-amber-heard-from-aquaman-2?utm_content=cl_sharecopy_14451136_en-US%3Av3&recruiter=1041155245&recruited_by_id=3c7c0450-47d8-11ea-83ce-0963bc1361e5&utm_source=share_petition&utm_medium=copylink&utm_campaign=psf_combo_share_abi,,Amber Heard domestically abused her ex husband and framed him for assault causing him to lose films. Sign this petition to remove her from Aquaman 2,420964,0,https://external-preview.redd.it/g9EyzUBMRstYmZt2OpRJZ_icbX3D159j0gnTjFaqM7A.jpg?auto=webp&s=dcb4253354ac3f0ae3669fa838bdfe25020bc32a,,,NONE,False,,,,ORIGINAL,,,,,False,False,750.0,1334.0,,0,0,link,357275_74_link,74,19521,,709,,,,,False,,,,20230,1702,,102,,,,,,,,11.213968957871398,,0,,False,False,,0,11.213968957871398,https://redd.it/ez4hyb,Pussy Pass Denied,3328c,3328c,https://www.reddit.com/r/pussypassdenied/,2015-11-01 15:40:57,,580106,0,,11,11,False,pussypassdenied,,,,,0,0,False,False,False
fDc3OTg2NDB8ZXo5Y3k0fDE1ODA5MDgzNjU=,7798640,ez9cy4,ez9cy4,7798640_ez9cy4,,2020-02-05 13:12:45,1,,http://chng.it/7qpykXJRVJ:=:https://www.change.org/p/dc-entertainment-remove-amber-heard-from-aquaman-2?utm_content=cl_sharecopy_14451136_en-US%3Av3&recruiter=1041155245&recruited_by_id=3c7c0450-47d8-11ea-83ce-0963bc1361e5&utm_source=share_petition&utm_medium=copylink&utm_campaign=psf_combo_share_abi,,"Psycho ruined Depp name, life and career. Give your support.",186716,0,,,,NONE,False,,,,ORIGINAL,,,,,False,False,,,,0,0,link,7798640_74_link,74,6328,,216,,,,,False,,,,6544,84,,11,,,,,,,,68.88421052631578,,0,,False,False,,0,68.88421052631578,https://redd.it/ez9cy4,EntitledBitch,trgqh,trgqh,https://www.reddit.com/r/EntitledBitch/,2019-07-08 21:32:28,2019-07-08T22:48:03,306210,0,,11,11,False,EntitledBitch,,,,,0,0,False,True,False
fDMxMjQzNXxqdjJpYXd8MTYwNTUxMDQ3Ng==,312435,jv2iaw,jv2iaw,312435_jv2iaw,,2020-11-16 07:07:56,1,,https://www.change.org/p/dc-entertainment-remove-amber-heard-from-aquaman-2?fbclid=IwAR3JZzy_XLB2WlihauOUBdO_S4RW3Um7Y9XFUbjGHg76P-MmBy0TYtb8pIU,,Sign to push for Amber Heard to be fired. Why? Because men are targeted and women get let off,284791,0,https://external-preview.redd.it/g9EyzUBMRstYmZt2OpRJZ_icbX3D159j0gnTjFaqM7A.jpg?auto=webp&s=dcb4253354ac3f0ae3669fa838bdfe25020bc32a,,,NONE,False,,,,ORIGINAL,,,,,False,False,750.0,1334.0,,0,0,link,312435_74_link,74,3327,,92,,,,,False,,,,3419,52,,12,,,,,,,,53.421875,,0,,False,False,,0,53.421875,https://redd.it/jv2iaw,Men's Rights :: Advocating for the social and legal equality of men and boys since 2008,2qhk3,2qhk3,https://www.reddit.com/r/MensRights/,2015-10-03 01:39:44,,302980,0,https://b.thumbs.redditmedia.com/s4-BK6rlpmJn8z7QDs-MkBoYn3XPWPdrdxEHPQWynGw.png,11,11,False,MensRights,,,,,0,0,False,False,False
fDMxMjQzNXxiNGNrMXh8MTU1MzMwMDA2NQ==,312435,b4ck1x,b4ck1x,312435_b4ck1x,,2019-03-23 00:14:25,1,,https://www.change.org/p/dc-entertainment-remove-amber-heard-from-aquaman-2?recruiter=24448735&utm_source=share_petition&utm_medium=copylink&utm_campaign=share_petition,,Petition To Remove 'Accused DV Perpetrator' Amber Heard from Aquaman 2,212151,0,https://external-preview.redd.it/yZC8nierrr2N_HmC6RbzYHKeJ75Ubu7NJQx7DKKxwxM.jpg?auto=webp&s=68d70650b40d258c92cc86ebb22b21e0d08d9aeb,,,NONE,False,,,,ORIGINAL,,,,,False,False,750.0,1334.0,,0,0,link,312435_74_link,74,2716,,229,,,,,False,,,,2945,58,,15,,,,,,,,40.342465753424655,,0,,False,False,,0,40.342465753424655,https://redd.it/b4ck1x,Men's Rights :: Advocating for the social and legal equality of men and boys since 2008,2qhk3,2qhk3,https://www.reddit.com/r/MensRights/,2015-10-03 01:39:44,,302980,0,https://b.thumbs.redditmedia.com/s4-BK6rlpmJn8z7QDs-MkBoYn3XPWPdrdxEHPQWynGw.png,11,11,False,MensRights,,,,,0,0,False,False,False
fDM1NzI3NXxpYXE2MGt8MTU5NzU3MzkwMQ==,357275,iaq60k,iaq60k,357275_iaq60k,,2020-08-16 10:31:41,1,,https://www.change.org/p/dc-entertainment-remove-amber-heard-from-aquaman-2?signed=true,,Petition to remove Amber Heard from future DCEU movies.,512141,0,https://external-preview.redd.it/g9EyzUBMRstYmZt2OpRJZ_icbX3D159j0gnTjFaqM7A.jpg?auto=webp&s=dcb4253354ac3f0ae3669fa838bdfe25020bc32a,,,NONE,False,,,,ORIGINAL,,,,,False,False,750.0,1334.0,,0,0,link,357275_13_link,13,1762,,95,,,,,False,,,,1857,115,,15,,,,,,,,14.284615384615385,,0,,False,False,,0,14.284615384615385,https://redd.it/iaq60k,Pussy Pass Denied,3328c,3328c,https://www.reddit.com/r/pussypassdenied/,2015-11-01 15:40:57,,580106,0,,11,11,False,pussypassdenied,,,,,0,0,False,False,False
fDMxMjQzNXxqczQxcXR8MTYwNTA4MTE0Ng==,312435,js41qt,js41qt,312435_js41qt,,2020-11-11 07:52:26,1,,http://chng.it/L92xjwKVjg:=:https://www.change.org/p/dc-entertainment-remove-amber-heard-from-aquaman-2?utm_content=cl_sharecopy_14451136_en-US%3Av3&recruiter=1163667311&recruited_by_id=b6e58e00-23f1-11eb-b74d-17aef4631222&utm_source=share_petition&utm_medium=copylink&utm_campaign=psf_combo_share_abi&utm_term=psf_combo_share_abi,,"Come on lads, sign it for Johnny Depp. you don't have to donate just sign this thing might not make a difference but at least we can show people we aren't okay with this",284502,0,https://external-preview.redd.it/g9EyzUBMRstYmZt2OpRJZ_icbX3D159j0gnTjFaqM7A.jpg?auto=webp&s=dcb4253354ac3f0ae3669fa838bdfe25020bc32a,,,NONE,False,,,,ORIGINAL,,,,,False,False,750.0,1334.0,,0,0,link,312435_74_link,74,1448,,92,,,,,False,,,,1540,54,,13,,,,,,,,22.98507462686567,,0,,False,False,,0,22.98507462686567,https://redd.it/js41qt,Men's Rights :: Advocating for the social and legal equality of men and boys since 2008,2qhk3,2qhk3,https://www.reddit.com/r/MensRights/,2015-10-03 01:39:44,,302980,0,https://b.thumbs.redditmedia.com/s4-BK6rlpmJn8z7QDs-MkBoYn3XPWPdrdxEHPQWynGw.png,11,11,False,MensRights,,,,,0,0,False,False,False
fDM1NzI3NXxqdGE2dTd8MTYwNTI0MDAyMQ==,357275,jta6u7,jta6u7,357275_jta6u7,,2020-11-13 04:00:21,1,,http://chng.it/QsyKvw5YYx:=:https://www.change.org/p/dc-entertainment-remove-amber-heard-from-aquaman-2?recruiter=68421204&recruited_by_id=64298590-4816-11e3-8466-29d00ca9d466&utm_source=share_petition&utm_medium=copylink&utm_campaign=psf_combo_share_abi,,Petition to get Amber Heard removed from Aquaman 2,538686,0,https://external-preview.redd.it/g9EyzUBMRstYmZt2OpRJZ_icbX3D159j0gnTjFaqM7A.jpg?auto=webp&s=dcb4253354ac3f0ae3669fa838bdfe25020bc32a,,,NONE,False,,,,ORIGINAL,,,,,False,False,750.0,1334.0,,0,0,link,357275_12_link,12,978,,21,,,,,False,,,,999,92,,11,,,,,,,,9.699029126213592,,0,,False,False,,0,9.699029126213592,https://redd.it/jta6u7,Pussy Pass Denied,3328c,3328c,https://www.reddit.com/r/pussypassdenied/,2015-11-01 15:40:57,,580106,0,,11,11,False,pussypassdenied,,,,,0,0,False,False,False
fDMxMjQzNXxqcTBydGN8MTYwNDc5MTQyMg==,312435,jq0rtc,jq0rtc,312435_jq0rtc,,2020-11-07 23:23:42,1,,https://www.change.org/p/dc-entertainment-remove-amber-heard-from-aquaman-2?signed=true,,Petition to remove Amber Heard from Aquaman 2,283757,0,https://external-preview.redd.it/g9EyzUBMRstYmZt2OpRJZ_icbX3D159j0gnTjFaqM7A.jpg?auto=webp&s=dcb4253354ac3f0ae3669fa838bdfe25020bc32a,,,NONE,False,,,,ORIGINAL,,,,,False,False,750.0,1334.0,,0,0,link,312435_74_link,74,691,,14,,,,,False,,,,705,48,,10,,,,,,,,12.155172413793103,,0,,False,False,,0,12.155172413793103,https://redd.it/jq0rtc,Men's Rights :: Advocating for the social and legal equality of men and boys since 2008,2qhk3,2qhk3,https://www.reddit.com/r/MensRights/,2015-10-03 01:39:44,,302980,0,https://b.thumbs.redditmedia.com/s4-BK6rlpmJn8z7QDs-MkBoYn3XPWPdrdxEHPQWynGw.png,11,11,False,MensRights,,,,,0,0,False,False,False
fDc1Mzk0MXxldWg3dHF8MTU4MDA5MTQ3NA==,753941,euh7tq,euh7tq,753941_euh7tq,,2020-01-27 02:17:54,1,,http://chng.it/7DPfVfw27w:=:https://www.change.org/p/dc-entertainment-remove-amber-heard-from-aquaman-2?utm_content=cl_sharecopy_14451136_en-US%3Av5&recruiter=1036840968&recruited_by_id=cbc7d330-40aa-11ea-ab61-99c21e230fe2&utm_source=share_petition&utm_medium=copylink&utm_campaign=psf_combo_share_abi&utm_term=psf_combo_share_abi&share_bandit_exp=abi-14451136-en-US&share_bandit_var=v1,,Petition to have Amber Heard booted from Aquaman 2 for falsely accusing Johnny Depp. Let's make sure what goes around comes around gents.,146574,0,https://external-preview.redd.it/g9EyzUBMRstYmZt2OpRJZ_icbX3D159j0gnTjFaqM7A.jpg?auto=webp&s=dcb4253354ac3f0ae3669fa838bdfe25020bc32a,,,NONE,False,,,,ORIGINAL,,,,,False,False,750.0,1334.0,,0,0,link,753941_54_link,54,604,,32,,,,,False,,,,636,211,,25,,,,,,,,2.694915254237288,,0,,False,False,,0,2.694915254237288,https://redd.it/euh7tq,Men Going Their Own Way,2sjgc,2sjgc,https://www.reddit.com/r/MGTOW/,2016-04-08 18:00:11,,147436,0,https://b.thumbs.redditmedia.com/NhsJLBUr1Hirjw4nOAoWC8nGC_UB3VcY4v5KbojlaHM.png,11,11,False,MGTOW,,,,,0,0,False,False,False
fDc1MzgzMnxlenF4NzN8MTU4MDk4NzYyMA==,753832,ezqx73,ezqx73,753832_ezqx73,,2020-02-06 11:13:40,1,"Amber Heard has been exposed as a domestic abuser by Johnny Depp. In his $50 million lawsuit, Johnny Depp describes many incidents of domestic abuse that he suffered at the hands of his (then) wife Amber Heard, including one incident where she punched him twice in the face and another where she shattered his finger with a vodka bottle, and his finger had to be surgically reattached. He will bear the scar from that for the rest of his life. 

Also, Amber Heard was arrested in 2009 for abusing a former domestic partner, Tasya Van Ree, demonstrating a repeated pattern of abuse by Amber Heard.

Since Heard's divorce from Johnny Depp, she has systematically crusaded to ruin Depp in Hollywood, repeating multiple accounts of fake incidents in which she had actually abused Johnny Depp, but lied and created false accounts of him being the abuser. About the incident during which she shattered the bones in Johnny Depp's finger and nearly severed it, causing Depp to require surgery to reattach and repair it, Heard presented a false story claiming that he cut off his finger himself, dipped it in paint and scrawled obscenities all over the walls. 

Likewise, Heard recounts fabricated incidents of Johnny Depp hitting her in the face when she had, in fact, punched him. Though staff and neighbors in the building where she lived reported seeing no marks on her face in the hours and days after she says Johnny Depp hit her, yet she appeared in court six (6) days later with bruises on her face, asking for a temporary restraining order, which was granted. Photos of Heard from the very next day show her full face, without makeup, and not a single bruise.

As Amber Heard is a known and proven domestic abuser, Warner Brothers and DC Entertainment should and must remove Heard from their Aquaman 2 film project. They must not ignore the suffering of Heard's victims, and must not glamorize a domestic abuser. 

Men are victims of domestic abuse, just like women. This must be recognized, and action must be taken to prevent a known abuser from being celebrated within the entertainment industry.

Do the right thing. Remove Amber Heard from Aquaman 2.


https://www.change.org/p/dc-entertainment-remove-amber-heard-from-aquaman-2",,,Vote to get Amber Heard removed from Aquaman 2,488945,0,https://external-preview.redd.it/g9EyzUBMRstYmZt2OpRJZ_icbX3D159j0gnTjFaqM7A.jpg?auto=webp&s=dcb4253354ac3f0ae3669fa838bdfe25020bc32a,,,NONE,False,,,,ORIGINAL,,,,,False,False,750.0,1334.0,,0,0,photo,753832_56_photo,56,505,,69,,,,,False,,,,574,8,,8,,,,,,,,35.875,,0,,False,False,,0,35.875,https://redd.it/ezqx73,"TrueOffMyChest, a place for people who need to speak their mind",2yuqy,2yuqy,https://www.reddit.com/r/TrueOffMyChest/,2016-04-08 17:58:54,,928263,0,,11,11,False,TrueOffMyChest,,,,,0,0,False,False,False
fDM1NzI3NXxqc2FsdGd8MTYwNTExMDEzMg==,357275,jsaltg,jsaltg,357275_jsaltg,,2020-11-11 15:55:32,1,,https://i.redd.it/hm2us6tzumy51.jpg,,We are almost over 800k! Lets get this self confessed domestic abuser off our screens! https://www.change.org/p/dc-entertainment-remove-amber-heard-from-aquaman-2,536547,0,https://preview.redd.it/hm2us6tzumy51.jpg?auto=webp&s=fe94d51cc691617444f45c4e1cdbeaabcbbed0fd,,,NONE,False,,,,ORIGINAL,,,,,False,False,1489.0,1440.0,,0,0,link,357275_10_link,10,473,,19,,,,,False,,,,492,87,,10,,,,,,,,5.072164948453608,,0,,False,False,,0,5.072164948453608,https://redd.it/jsaltg,Pussy Pass Denied,3328c,3328c,https://www.reddit.com/r/pussypassdenied/,2015-11-01 15:40:57,,580106,0,,11,11,False,pussypassdenied,,,,,0,0,False,False,False
fDc1MzQ2MHxiNGlhYXZ8MTU1MzM0MTU0OQ==,753460,b4iaav,b4iaav,753460_b4iaav,,2019-03-23 11:45:49,1,,https://www.change.org/p/dc-entertainment-remove-amber-heard-from-aquaman-2?recruiter=24448735&utm_source=share_petition&utm_medium=copylink&utm_campaign=share_petition,,Stop her before she gets another pussy pass.,46742,0,https://external-preview.redd.it/yZC8nierrr2N_HmC6RbzYHKeJ75Ubu7NJQx7DKKxwxM.jpg?auto=webp&s=68d70650b40d258c92cc86ebb22b21e0d08d9aeb,,,NONE,False,,,,ORIGINAL,,,,,False,False,750.0,1334.0,,0,0,link,753460_74_link,74,405,,27,,,,,False,,,,432,177,,16,,,,,,,,2.238341968911917,,0,,False,False,,0,2.238341968911917,https://redd.it/b4iaav,A place for the Pussy Pass,2whjo,2whjo,https://www.reddit.com/r/PussyPass/,2016-04-08 17:54:03,,81608,0,,11,11,False,PussyPass,,,,,0,0,False,False,False
fDMxMjQzNXxleGZqaGN8MTU4MDYwMzI4MQ==,312435,exfjhc,exfjhc,312435_exfjhc,,2020-02-02 00:28:01,1,,https://www.change.org/p/dc-entertainment-remove-amber-heard-from-aquaman-2,,"In light of the recent audio tape release, i think this is the right time to point out that there's a petition out there to get Amber Heard fired from the Aquaman franchise...",249125,0,https://external-preview.redd.it/g9EyzUBMRstYmZt2OpRJZ_icbX3D159j0gnTjFaqM7A.jpg?auto=webp&s=dcb4253354ac3f0ae3669fa838bdfe25020bc32a,,,NONE,False,,,,ORIGINAL,,,,,False,False,750.0,1334.0,,0,0,link,312435_74_link,74,363,,62,,,,,False,,,,425,66,,15,,,,,,,,5.246913580246914,,0,,False,False,,0,5.246913580246914,https://redd.it/exfjhc,Men's Rights :: Advocating for the social and legal equality of men and boys since 2008,2qhk3,2qhk3,https://www.reddit.com/r/MensRights/,2015-10-03 01:39:44,,302980,0,https://b.thumbs.redditmedia.com/s4-BK6rlpmJn8z7QDs-MkBoYn3XPWPdrdxEHPQWynGw.png,11,11,False,MensRights,,,,,0,0,False,False,False
fDMxMjQzNXxqc2R1dDB8MTYwNTEyMDAwMw==,312435,jsdut0,jsdut0,312435_jsdut0,,2020-11-11 18:40:03,1,,https://www.change.org/p/dc-entertainment-remove-amber-heard-from-aquaman-2?utm_content=cl_sharecopy_14451136_en-US%3Av3&recruiter=12400631&recruited_by_id=5a454420-f3a5-012f-7451-4040acce234c&utm_source=share_petition&utm_medium=copylink&utm_campaign=psf_combo_share_abi&utm_term=psf_combo_share_abi,,Remove Amber heard from Aquaman 2,284502,0,https://external-preview.redd.it/g9EyzUBMRstYmZt2OpRJZ_icbX3D159j0gnTjFaqM7A.jpg?auto=webp&s=dcb4253354ac3f0ae3669fa838bdfe25020bc32a,,,NONE,False,,,,ORIGINAL,,,,,False,False,750.0,1334.0,,0,0,link,312435_74_link,74,280,,9,,,,,False,,,,289,54,,13,,,,,,,,4.313432835820896,,0,,False,False,,0,4.313432835820896,https://redd.it/jsdut0,Men's Rights :: Advocating for the social and legal equality of men and boys since 2008,2qhk3,2qhk3,https://www.reddit.com/r/MensRights/,2015-10-03 01:39:44,,302980,0,https://b.thumbs.redditmedia.com/s4-BK6rlpmJn8z7QDs-MkBoYn3XPWPdrdxEHPQWynGw.png,11,11,False,MensRights,,,,,0,0,False,False,False
fDM1NzI3NXxuMWF5cmt8MTYxOTcyMTM4Mg==,357275,n1ayrk,n1ayrk,357275_n1ayrk,,2021-04-29 18:36:22,1,,https://www.change.org/p/dc-entertainment-remove-amber-heard-from-aquaman-2,,Remove Amber Heard from Aquaman 2,577992,0,https://external-preview.redd.it/g9EyzUBMRstYmZt2OpRJZ_icbX3D159j0gnTjFaqM7A.jpg?auto=webp&s=dcb4253354ac3f0ae3669fa838bdfe25020bc32a,,,NONE,False,,,,ORIGINAL,,,,,False,False,750.0,1334.0,,0,0,link,357275_34_link,34,193,,26,,,,,False,,,,219,378,,35,,,,,,,,-1.885844748858447,,0,,False,False,,0,-1.885844748858447,https://redd.it/n1ayrk,Pussy Pass Denied,3328c,3328c,https://www.reddit.com/r/pussypassdenied/,2015-11-01 15:40:57,,580106,0,,11,11,False,pussypassdenied,,,,,0,0,False,False,False
fDM1NzI3NXxqc211cjZ8MTYwNTE1MDIzOQ==,357275,jsmur6,jsmur6,357275_jsmur6,,2020-11-12 03:03:59,1,,https://www.change.org/p/dc-entertainment-remove-amber-heard-from-aquaman-2,,Petition to Remove Amber Heard from Aquaman 2,536547,0,https://external-preview.redd.it/g9EyzUBMRstYmZt2OpRJZ_icbX3D159j0gnTjFaqM7A.jpg?auto=webp&s=dcb4253354ac3f0ae3669fa838bdfe25020bc32a,,,NONE,False,,,,ORIGINAL,,,,,False,False,750.0,1334.0,,0,0,link,357275_37_link,37,198,,13,,,,,False,,,,211,460,,24,,,,,,,,-2.293838862559242,,0,,False,False,,0,-2.293838862559242,https://redd.it/jsmur6,Pussy Pass Denied,3328c,3328c,https://www.reddit.com/r/pussypassdenied/,2015-11-01 15:40:57,,580106,0,,11,11,False,pussypassdenied,,,,,0,0,False,False,False
fDMxMjQzNXxqcHV6b2N8MTYwNDc3MjUyNQ==,312435,jpuzoc,jpuzoc,312435_jpuzoc,,2020-11-07 18:08:45,1,,http://chng.it/9WfykGCmKG:=:https://www.change.org/p/dc-entertainment-remove-amber-heard-from-aquaman-2?utm_content=cl_sharecopy_14451136_en-US%3Av3&recruiter=962310807&recruited_by_id=67a788f0-78b4-11e9-b30f-cfa2655a5192&utm_source=share_petition&utm_medium=copylink&utm_campaign=psf_combo_share_abi,,Petition to get amber beard removed from Aquaman and and adjoining petition to get depp back on fantastic beats,283757,0,https://external-preview.redd.it/g9EyzUBMRstYmZt2OpRJZ_icbX3D159j0gnTjFaqM7A.jpg?auto=webp&s=dcb4253354ac3f0ae3669fa838bdfe25020bc32a,,,NONE,False,,,,ORIGINAL,,,,,False,False,750.0,1334.0,,0,0,link,312435_74_link,74,197,,10,,,,,False,,,,207,48,,10,,,,,,,,3.568965517241379,,0,,False,False,,0,3.568965517241379,https://redd.it/jpuzoc,Men's Rights :: Advocating for the social and legal equality of men and boys since 2008,2qhk3,2qhk3,https://www.reddit.com/r/MensRights/,2015-10-03 01:39:44,,302980,0,https://b.thumbs.redditmedia.com/s4-BK6rlpmJn8z7QDs-MkBoYn3XPWPdrdxEHPQWynGw.png,11,11,False,MensRights,,,,,0,0,False,False,False
fDc1Mzk0MXxkd29qMGp8MTU3MzgxMDk2Nw==,753941,dwoj0j,dwoj0j,753941_dwoj0j,,2019-11-15 09:42:47,1,,http://chng.it/mbkHrGKdmG:=:https://www.change.org/p/dc-entertainment-remove-amber-heard-from-aquaman-2?utm_content=cl_sharecopy_14451136_en-US%3Av5&recruiter=844449191&recruited_by_id=9b981050-e691-11e7-b83d-c7e80f42ac54&utm_source=share_petition&utm_medium=copylink&utm_campaign=psf_combo_share_abi&share_bandit_exp=abi-14451136-en-US&share_bandit_var=v1,,Wow we reached 135k members. Let's do some good and sign this petition brothers!,135945,0,https://external-preview.redd.it/g9EyzUBMRstYmZt2OpRJZ_icbX3D159j0gnTjFaqM7A.jpg?auto=webp&s=dcb4253354ac3f0ae3669fa838bdfe25020bc32a,,,NONE,False,,,,ORIGINAL,,,,,False,False,750.0,1334.0,,0,0,link,753941_61_link,61,158,,26,,,,,False,,,,184,164,,26,,,,,,,,-1.032608695652173,,0,,False,False,,0,-1.032608695652173,https://redd.it/dwoj0j,Men Going Their Own Way,2sjgc,2sjgc,https://www.reddit.com/r/MGTOW/,2016-04-08 18:00:11,,147436,0,https://b.thumbs.redditmedia.com/NhsJLBUr1Hirjw4nOAoWC8nGC_UB3VcY4v5KbojlaHM.png,11,11,False,MGTOW,,,,,0,0,False,False,False
fDMxMjQzNXxqcXFkd2N8MTYwNDg5MzkzNA==,312435,jqqdwc,jqqdwc,312435_jqqdwc,,2020-11-09 03:52:14,1,"Jason Momoa is always promoting values and speaking up for things yet is keeping really quiet on working with an abuser, we need to put pressure on him. Let's flood his comments section and call for him to speak up.

His instagram handle is /prideofgypsies

Warner brothers instagram is /wbpictures (already getting flooded)

Also here is the petition for anyone who hasn't seen it.[https://www.change.org/p/dc-entertainment-remove-amber-heard-from-aquaman-2](https://www.change.org/p/dc-entertainment-remove-amber-heard-from-aquaman-2)

Look I'm just really furious that Amber Heard has not been removed after hearing the tapes. If I'm not going about it the right way please someone kindly let me know.",,,We need male celebrities such as Jason Momoa to speak up against abuser Amber Heard,284087,0,https://external-preview.redd.it/g9EyzUBMRstYmZt2OpRJZ_icbX3D159j0gnTjFaqM7A.jpg?auto=webp&s=dcb4253354ac3f0ae3669fa838bdfe25020bc32a,,,NONE,False,,,,ORIGINAL,,,,,False,False,750.0,1334.0,,0,0,photo,312435_74_photo,74,163,,18,,,,,False,,,,181,44,,15,,,,,,,,3.067796610169491,,0,,False,False,,0,3.067796610169491,https://redd.it/jqqdwc,Men's Rights :: Advocating for the social and legal equality of men and boys since 2008,2qhk3,2qhk3,https://www.reddit.com/r/MensRights/,2015-10-03 01:39:44,,302980,0,https://b.thumbs.redditmedia.com/s4-BK6rlpmJn8z7QDs-MkBoYn3XPWPdrdxEHPQWynGw.png,11,11,False,MensRights,,,,,0,0,False,False,False
fDM1NzM3MXxqcTk4OTR8MTYwNDgyOTE2Ng==,357371,jq9894,jq9894,357371_jq9894,,2020-11-08 09:52:46,1,,https://i.redd.it/waycjzejnzx51.jpg,,Repost from pdp submissions but it's important and I'm lazy https://www.change.org/p/dc-entertainment-remove-amber-heard-from-aquaman-2,13457440,0,https://preview.redd.it/waycjzejnzx51.jpg?auto=webp&s=15ba6f646264c72abb7cb9eb820197d50ec6bf89,,,NONE,False,,,,ORIGINAL,,,,,False,False,926.0,760.0,,0,0,link,357371_9_link,9,142,,22,,,,,False,,,,164,61,,4,,,,,,,,2.523076923076923,,0,,False,False,,0,2.523076923076923,https://redd.it/jq9894,/r/Memes the original since 2008,2qjpg,2qjpg,https://www.reddit.com/r/memes/,2015-11-01 15:43:50,,15520560,0,,11,11,False,memes,,,,,0,0,False,False,False
fDM1NzI3NXxsbzR6bHd8MTYxMzgxOTMyNA==,357275,lo4zlw,lo4zlw,357275_lo4zlw,,2021-02-20 11:08:44,1,,https://www.change.org/p/dc-entertainment-remove-amber-heard-from-aquaman-2,,Remove Amber Heard from Aquaman 2,570055,0,https://external-preview.redd.it/g9EyzUBMRstYmZt2OpRJZ_icbX3D159j0gnTjFaqM7A.jpg?auto=webp&s=dcb4253354ac3f0ae3669fa838bdfe25020bc32a,,,NONE,False,,,,ORIGINAL,,,,,False,False,750.0,1334.0,,0,0,link,357275_21_link,21,147,,10,,,,,False,,,,157,407,,30,,,,,,,,-2.78343949044586,,0,,False,False,,0,-2.78343949044586,https://redd.it/lo4zlw,Pussy Pass Denied,3328c,3328c,https://www.reddit.com/r/pussypassdenied/,2015-11-01 15:40:57,,580106,0,,11,11,False,pussypassdenied,,,,,0,0,False,False,False
fDMxMjQzNXxla25haGd8MTU3ODI3NzUwOA==,312435,eknahg,eknahg,312435_eknahg,,2020-01-06 02:25:08,1,,https://www.change.org/p/dc-entertainment-remove-amber-heard-from-aquaman-2/u/24331738,,Petition to remove the abuser Amber Heard from L'Oreal. Make sure you avoid male brands such as Kiehl's owned by them.,245794,0,https://external-preview.redd.it/hnEokMwvRgJ_-uEWh2l8H55Uv7jM9Wco842fV-5ec40.jpg?auto=webp&s=912f3774054ddb057af78e2708ea01a3c203b231,,,NONE,False,,,,ORIGINAL,,,,,False,False,346.0,615.0,,0,0,link,312435_74_link,74,131,,12,,,,,False,,,,143,60,,16,,,,,,,,1.881578947368421,,0,,False,False,,0,1.881578947368421,https://redd.it/eknahg,Men's Rights :: Advocating for the social and legal equality of men and boys since 2008,2qhk3,2qhk3,https://www.reddit.com/r/MensRights/,2015-10-03 01:39:44,,302980,0,https://b.thumbs.redditmedia.com/s4-BK6rlpmJn8z7QDs-MkBoYn3XPWPdrdxEHPQWynGw.png,11,11,False,MensRights,,,,,0,0,False,False,False
fDMxMjQzNXxmNXI2OGp8MTU4MjAyOTUxNA==,312435,f5r68j,f5r68j,312435_f5r68j,,2020-02-18 12:38:34,1,,https://www.change.org/p/dc-entertainment-remove-amber-heard-from-aquaman-2/u/25763381,,Amber Heard desperate to tie Depp to Harvey Weinstein,251347,0,https://external-preview.redd.it/BO9cFxLsO0bo3Hx6J9lXs54akEps5dmhbfkuDu--LkY.jpg?auto=webp&s=16bffeb2ee493687c5787c36a3d74157c6ad5648,,,NONE,False,,,,ORIGINAL,,,,,False,False,576.0,1024.0,,0,0,link,312435_73_link,73,110,,13,,,,,False,,,,123,68,,15,,,,,,,,1.481927710843373,,0,,False,False,,0,1.481927710843373,https://redd.it/f5r68j,Men's Rights :: Advocating for the social and legal equality of men and boys since 2008,2qhk3,2qhk3,https://www.reddit.com/r/MensRights/,2015-10-03 01:39:44,,302980,0,https://b.thumbs.redditmedia.com/s4-BK6rlpmJn8z7QDs-MkBoYn3XPWPdrdxEHPQWynGw.png,11,11,False,MensRights,,,,,0,0,False,False,False
